{
  "item_id": "cand-okonkwo",
  "round": 3,
  "max_rounds": 3,
  "mode": "initial",
  "status": "capped-disputed",
  "open_counts": {
    "blocker": 0,
    "major": 0,
    "minor": 0
  },
  "signoffs": {
    "factcheck": {
      "signed": false,
      "at": null,
      "round": null
    },
    "sourcing": {
      "signed": false,
      "at": null,
      "round": null
    },
    "neutrality": {
      "signed": false,
      "at": null,
      "round": null
    },
    "privacy-legal": {
      "signed": false,
      "at": null,
      "round": null
    }
  },
  "gaps": [],
  "removed_claims": [],
  "updated_at": "2026-10-20 12:00 ET"
}
