{
  "item_id": "cand-quinn",
  "round": 1,
  "max_rounds": 3,
  "mode": "initial",
  "status": "signed-off",
  "open_counts": {
    "blocker": 0,
    "major": 0,
    "minor": 0
  },
  "signoffs": {
    "factcheck": {
      "signed": true,
      "at": "2026-10-20 12:00 ET",
      "round": 1
    },
    "sourcing": {
      "signed": true,
      "at": "2026-10-20 12:00 ET",
      "round": 1
    },
    "neutrality": {
      "signed": true,
      "at": "2026-10-20 12:00 ET",
      "round": 1
    },
    "privacy-legal": {
      "signed": true,
      "at": "2026-10-20 12:00 ET",
      "round": 1
    }
  },
  "gaps": [],
  "removed_claims": [],
  "updated_at": "2026-10-20 12:00 ET"
}
